{
  "bindings": {
    "candidate_files_inventory_sha256": "CC7161005A1D88E6D6F97477839DF6511BC12A24BD1FEBBF19EE4760FF8EABFA",
    "candidate_manifest_sha256": "A1045CBD368B57D4766F1E978E0315E78D33F37859119369AA0B69909BAD04C1",
    "master_ru_acceptance_sha256": "648307536F72A08463F77964EA501EA44BD3130602D01FC814ABD96B30EAC12D",
    "master_ru_asset_manifest_sha256": "A12565F3B3EC1BE3047C9E660438275E857E1371C502557ABC27EAA18E3B56AD",
    "master_ru_sha256": "904133D5057172C404D28F3BCF2A5E4C578304A59382512D1B31FC56AE0FDAB2",
    "profile_sha256": "F9DB1D10F8024B9A48CDAF3C64CB7461775C27B94D55AB5A6AFC885837379357",
    "reconstruction_inventory_sha256": "B37142B8CFB0E85A9BFF157E1DF435D24EDEE13E1F6B755B064E2108CF4E1547",
    "source_identity_sha256": "17EA15D089FDFA672620529CAB9883E025208CF33938819A0D87F29422004432",
    "source_pdf_sha256": "C03AD05644C5B7438E4FAB750557EB8098E637492242D21969C5C4110FBF97D0"
  },
  "decisions": [
    {
      "asset_id": "pdf-page-001-cover",
      "binary": {
        "candidate_id": null,
        "choice": null
      },
      "notes": "",
      "presentation": {
        "alignment": "center",
        "width_percent": 100,
        "wrap_tables": false,
        "wrap_text": false
      },
      "reviewed": false
    },
    {
      "asset_id": "page-004-xref-80-gen-0-resource-image100",
      "binary": {
        "candidate_id": null,
        "choice": null
      },
      "notes": "",
      "presentation": {
        "alignment": "right",
        "width_percent": 25,
        "wrap_tables": false,
        "wrap_text": true
      },
      "reviewed": false
    },
    {
      "asset_id": "page-005-xref-80-gen-0-resource-image100",
      "binary": {
        "candidate_id": null,
        "choice": null
      },
      "notes": "",
      "presentation": {
        "alignment": "right",
        "width_percent": 25,
        "wrap_tables": false,
        "wrap_text": true
      },
      "reviewed": false
    },
    {
      "asset_id": "page-006-xref-15-gen-0-resource-image110",
      "binary": {
        "candidate_id": null,
        "choice": null
      },
      "notes": "",
      "presentation": {
        "alignment": "right",
        "width_percent": 25,
        "wrap_tables": false,
        "wrap_text": true
      },
      "reviewed": false
    },
    {
      "asset_id": "page-007-xref-19-gen-0-resource-image112",
      "binary": {
        "candidate_id": null,
        "choice": null
      },
      "notes": "",
      "presentation": {
        "alignment": "right",
        "width_percent": 25,
        "wrap_tables": false,
        "wrap_text": true
      },
      "reviewed": false
    },
    {
      "asset_id": "page-007-xref-21-gen-0-resource-image115",
      "binary": {
        "candidate_id": null,
        "choice": null
      },
      "notes": "",
      "presentation": {
        "alignment": "right",
        "width_percent": 25,
        "wrap_tables": false,
        "wrap_text": true
      },
      "reviewed": false
    },
    {
      "asset_id": "page-008-xref-24-gen-0-resource-image118",
      "binary": {
        "candidate_id": null,
        "choice": null
      },
      "notes": "",
      "presentation": {
        "alignment": "right",
        "width_percent": 25,
        "wrap_tables": false,
        "wrap_text": true
      },
      "reviewed": false
    },
    {
      "asset_id": "page-009-xref-80-gen-0-resource-image100",
      "binary": {
        "candidate_id": null,
        "choice": null
      },
      "notes": "",
      "presentation": {
        "alignment": "right",
        "width_percent": 25,
        "wrap_tables": false,
        "wrap_text": true
      },
      "reviewed": false
    },
    {
      "asset_id": "page-011-xref-31-gen-0-resource-image149",
      "binary": {
        "candidate_id": null,
        "choice": null
      },
      "notes": "",
      "presentation": {
        "alignment": "right",
        "width_percent": 25,
        "wrap_tables": false,
        "wrap_text": true
      },
      "reviewed": false
    },
    {
      "asset_id": "page-013-xref-36-gen-0-resource-image152",
      "binary": {
        "candidate_id": null,
        "choice": null
      },
      "notes": "",
      "presentation": {
        "alignment": "right",
        "width_percent": 25,
        "wrap_tables": false,
        "wrap_text": true
      },
      "reviewed": false
    },
    {
      "asset_id": "page-014-xref-39-gen-0-resource-image159",
      "binary": {
        "candidate_id": null,
        "choice": null
      },
      "notes": "",
      "presentation": {
        "alignment": "right",
        "width_percent": 25,
        "wrap_tables": false,
        "wrap_text": true
      },
      "reviewed": false
    },
    {
      "asset_id": "page-015-xref-42-gen-0-resource-image161",
      "binary": {
        "candidate_id": null,
        "choice": null
      },
      "notes": "",
      "presentation": {
        "alignment": "right",
        "width_percent": 25,
        "wrap_tables": false,
        "wrap_text": true
      },
      "reviewed": false
    },
    {
      "asset_id": "page-017-xref-47-gen-0-resource-image164",
      "binary": {
        "candidate_id": null,
        "choice": null
      },
      "notes": "",
      "presentation": {
        "alignment": "right",
        "width_percent": 25,
        "wrap_tables": false,
        "wrap_text": true
      },
      "reviewed": false
    },
    {
      "asset_id": "master-page-020-asset-001",
      "binary": {
        "candidate_id": null,
        "choice": null
      },
      "notes": "",
      "presentation": {
        "alignment": "right",
        "width_percent": 25,
        "wrap_tables": false,
        "wrap_text": true
      },
      "reviewed": false
    },
    {
      "asset_id": "page-021-xref-58-gen-0-resource-image171",
      "binary": {
        "candidate_id": null,
        "choice": null
      },
      "notes": "",
      "presentation": {
        "alignment": "right",
        "width_percent": 25,
        "wrap_tables": false,
        "wrap_text": true
      },
      "reviewed": false
    },
    {
      "asset_id": "page-022-xref-61-gen-0-resource-image174",
      "binary": {
        "candidate_id": null,
        "choice": null
      },
      "notes": "",
      "presentation": {
        "alignment": "right",
        "width_percent": 25,
        "wrap_tables": false,
        "wrap_text": true
      },
      "reviewed": false
    },
    {
      "asset_id": "page-023-xref-64-gen-0-resource-image177",
      "binary": {
        "candidate_id": null,
        "choice": null
      },
      "notes": "",
      "presentation": {
        "alignment": "right",
        "width_percent": 25,
        "wrap_tables": false,
        "wrap_text": true
      },
      "reviewed": false
    },
    {
      "asset_id": "page-024-xref-67-gen-0-resource-image180",
      "binary": {
        "candidate_id": null,
        "choice": null
      },
      "notes": "",
      "presentation": {
        "alignment": "right",
        "width_percent": 25,
        "wrap_tables": false,
        "wrap_text": true
      },
      "reviewed": false
    },
    {
      "asset_id": "page-025-xref-70-gen-0-resource-image183",
      "binary": {
        "candidate_id": null,
        "choice": null
      },
      "notes": "",
      "presentation": {
        "alignment": "right",
        "width_percent": 25,
        "wrap_tables": false,
        "wrap_text": true
      },
      "reviewed": false
    },
    {
      "asset_id": "page-026-xref-73-gen-0-resource-image186",
      "binary": {
        "candidate_id": null,
        "choice": null
      },
      "notes": "",
      "presentation": {
        "alignment": "right",
        "width_percent": 25,
        "wrap_tables": false,
        "wrap_text": true
      },
      "reviewed": false
    }
  ],
  "decisions_sha256": "257FC66B789F52F68E8F5C1CA85D7318654AA03E504132950163D373AB537890",
  "review": {
    "reviewed_count": 0,
    "state": "open",
    "unresolved_asset_ids": [
      "pdf-page-001-cover",
      "page-004-xref-80-gen-0-resource-image100",
      "page-005-xref-80-gen-0-resource-image100",
      "page-006-xref-15-gen-0-resource-image110",
      "page-007-xref-19-gen-0-resource-image112",
      "page-007-xref-21-gen-0-resource-image115",
      "page-008-xref-24-gen-0-resource-image118",
      "page-009-xref-80-gen-0-resource-image100",
      "page-011-xref-31-gen-0-resource-image149",
      "page-013-xref-36-gen-0-resource-image152",
      "page-014-xref-39-gen-0-resource-image159",
      "page-015-xref-42-gen-0-resource-image161",
      "page-017-xref-47-gen-0-resource-image164",
      "master-page-020-asset-001",
      "page-021-xref-58-gen-0-resource-image171",
      "page-022-xref-61-gen-0-resource-image174",
      "page-023-xref-64-gen-0-resource-image177",
      "page-024-xref-67-gen-0-resource-image180",
      "page-025-xref-70-gen-0-resource-image183",
      "page-026-xref-73-gen-0-resource-image186"
    ]
  },
  "scenario_id": "number-7-dream",
  "schema": "kb_creator.scenario_artview_decisions.v4",
  "state": "draft"
}
